{
  "$id": "run-ledger.schema.json",
  "$schema": "https://json-schema.org/draft/2020-12/schema",
  "title": "Run Ledger",
  "description": "Groundwork run ledger — the orchestrator's session-scoped work record stored under .groundwork/runs/<session_id>.json (legacy: .groundwork/run.json).",
  "$comment": "ENFORCEMENT MODEL: Two-tier depending on command. (1) HARD at `init` (cmdInit calls checkLedgerStrict): schema violations are treated as hard errors — they throw with exitCode=1, so a schema-violating ledger can never be written at init time. (2) ADVISORY for all other mutations (complete, gate, set, add — these call the soft checkLedger): schema violations surface as warnings to stderr, the command succeeds with exit 0. Rationale: a running session must be able to drain its ledger even if an older schema version wrote something structurally non-conformant. The three hand-written HARD checks (exit 1, all commands): (1) blocked_by referential integrity — referenced ids must exist in slices[]; (2) acceptance array must be non-empty; (3) individual acceptance strings must be non-empty. Additional invariants the schema does NOT cover at all: (a) acceptance-criteria satisfaction — strings are free-form, not evaluated; (b) write_token secrecy — schema treats it as an opaque string; (c) slice id uniqueness — JSON Schema cannot assert uniqueness of non-primitive items across arrays.",

  "type": "object",
  "required": ["session_id", "active", "slices"],
  "properties": {
    "session_id": {
      "type": "string",
      "description": "UUID of the Claude Code session that owns this ledger."
    },
    "active": {
      "type": "boolean",
      "description": "False once the run is abandoned or the stop-gate releases the session."
    },
    "goal": {
      "type": "string",
      "description": "One-sentence description of the run's objective (preferred field; older ledgers used 'brief')."
    },
    "brief": {
      "type": "string",
      "description": "Legacy alias for 'goal'. Accepted for back-compat."
    },
    "plan_ref": {
      "type": ["string", "null"],
      "description": "Path (or null) to the plan file consulted for this run."
    },
    "write_token": {
      "type": "string",
      "description": "Opaque random token required for gate/complete mutations. Treated as a secret; never reproduced in logs."
    },
    "reinforcements": {
      "description": "Arbitrary extra context or annotations attached by the orchestrator."
    },
    "progressSig": {
      "description": "Opaque progress signal used by the stop-gate hook."
    },
    "awaiting_human": {
      "type": "boolean",
      "description": "When true, the stop-gate will not nag while the orchestrator is correctly paused awaiting a human decision. Set only via `ledger await-human --token <write_token>`. Cleared with --clear. Does NOT bypass the completion gate — releasing the hold resumes normal enforcement."
    },
    "gate": {
      "type": "object",
      "description": "Gate verdicts keyed by gate name (advisor, verifier, qa).",
      "properties": {
        "advisor": {
          "$ref": "#/$defs/advisorGate"
        },
        "verifier": {
          "type": "string"
        },
        "qa": {
          "type": "string"
        },
        "seal": {
          "type": "string",
          "description": "HMAC-SHA256 hex seal over the canonical release state. Written by ledger init. Any mutation that touches release-affecting state must update this seal via the write-token path or the stop-gate will block (fail-closed)."
        },
        "phases": {
          "type": "object",
          "description": "Per-phase verification record (phase-checkpoint-gate). Map keyed by phase key ('plan', 'design', 'wave-<n>', 'completion'), each value carrying deliverable, verdict, tier, and verifier identity. Lives under gate so the existing write-token + seal machinery covers it.",
          "additionalProperties": {
            "type": "object",
            "required": ["deliverable", "tier"],
            "properties": {
              "deliverable": {
                "type": "string",
                "description": "Human-readable deliverable reference for this phase."
              },
              "tier": {
                "type": "string",
                "enum": ["BLOCKS", "AUTO_ADVANCES"],
                "description": "BLOCKS: session cannot end without human APPROVE verdict. AUTO_ADVANCES: emits directive only, no blocking."
              },
              "verdict": {
                "type": "string",
                "enum": ["APPROVE", "REJECT", "PENDING"],
                "description": "Verdict written by the checkpoint CLI command. Absent until the phase is explicitly verified."
              },
              "verified_by": {
                "type": "string",
                "description": "Identity of the verifier (session id or operator username)."
              },
              "verified_at": {
                "type": "string",
                "format": "date-time",
                "description": "ISO 8601 timestamp of verification."
              },
              "artifacts": {
                "type": "array",
                "items": { "type": "string" },
                "description": "Paths or URLs of artifacts the verifier reviewed."
              }
            },
            "additionalProperties": false
          }
        }
      },
      "additionalProperties": true
    },
    "pacing": {
      "type": "object",
      "description": "Optional session-pacing policy (D-28). Absent means pacing is disabled; existing ledgers without this field validate unchanged. Consumption (resolved units) is derived at runtime and adjusted by the stored offset.",
      "required": ["policy", "budget"],
      "properties": {
        "policy": {
          "type": "string",
          "enum": ["wave", "slice", "milestone"],
          "description": "Unit of pacing. 'wave' counts completed waves; 'slice' counts completed non-exempt slices; 'milestone' gates on human-verified shippable deliverables (see milestone_artifacts and milestone_signoff)."
        },
        "budget": {
          "type": "integer",
          "minimum": 0,
          "description": "Number of units the session may start before pacing blocks further claims. 0 means no new units may be started without a grant."
        },
        "exempt_kinds": {
          "type": "array",
          "items": {
            "type": "string",
            "enum": ["plan", "diagnose", "design", "impl", "fog"]
          },
          "description": "Slice kinds that are always claimable and never counted against budget (e.g. orientation work: plan, diagnose, design, fog)."
        },
        "offset": {
          "type": "integer",
          "minimum": 0,
          "description": "Number of units already resolved in the seed ledger at init time. Subtracted from resolvedUnits so prior-session completions don't count against this session's budget (F14 fix)."
        },
        "grant": {
          "type": "object",
          "description": "Temporary budget extension written by 'ledger autopilot'. Expires with the session.",
          "required": ["range", "granted_at", "granted_by", "reason"],
          "properties": {
            "range": {
              "type": "integer",
              "minimum": 1,
              "description": "Number of additional units granted on top of budget."
            },
            "granted_at": {
              "type": "string",
              "format": "date-time",
              "description": "ISO 8601 timestamp when the grant was issued."
            },
            "granted_by": {
              "type": "string",
              "description": "Identity that issued the grant (e.g. orchestrator session id or 'autopilot')."
            },
            "reason": {
              "type": "string",
              "description": "Human-readable rationale for the grant."
            }
          },
          "additionalProperties": false
        },
        "milestone_artifacts": {
          "type": "array",
          "description": "Declared evidence artifacts for milestone sign-off (policy=milestone). A hook validates each artifact's presence and freshness by comparing captured_build_hash against the current build hash — reusing the traceability evidence freshness mechanism rather than inventing a second scheme.",
          "items": {
            "$ref": "#/$defs/milestoneArtifact"
          }
        },
        "milestone_signoff": {
          "$ref": "#/$defs/milestoneSignoff",
          "description": "Human sign-off on the milestone. SECURITY: S7 MUST require write_token authority to record this field — a subagent must not be able to sign off on its own work (see PACING-R-008)."
        }
      },
      "additionalProperties": false
    },
    "slices": {
      "type": "array",
      "description": "Ordered list of work slices tracked by this run.",
      "items": {
        "$ref": "#/$defs/slice"
      }
    },
    "schema_version": {
      "type": "integer",
      "minimum": 1,
      "description": "Schema version marking the sealed regime (S2). Absent on pre-sealed legacy ledgers. Written by cmdInit when the sealed regime is active."
    },
    "version": {
      "type": "integer",
      "description": "Legacy schema version field used before the sealed regime (pre-S2). Superseded by schema_version. Accepted for backward compatibility with old ledgers on disk."
    },
    "motive": {
      "type": "string",
      "description": "Motive id (slug) this run is linked to. Written by `ledger init --motive <id>`."
    },
    "base_commit": {
      "type": "string",
      "description": "Git HEAD sha captured at init time. Written by cmdInit when the project dir is a git repository, and settable later via `gw ledger set --base-commit <sha>`. The comment-density gate scans base_commit..HEAD, so an APPROVE gate cannot run without it."
    },
    "motive_ref": {
      "type": "string",
      "description": "Motive slug passed via init input JSON. Read by stop-gate to satisfy the plan-artifact requirement (alternative to motive)."
    },
    "rfc_ref": {
      "type": "string",
      "description": "Legacy objective pointer read by journal-io.mjs as a fallback motive source. Informational; does not block session close."
    },
    "session_ids": {
      "type": "array",
      "items": { "type": "string" },
      "description": "Multi-session id list read by motive-ground-truth.mjs (ledger.session_ids ?? [ledger.session_id]). Optional; normally derived from session_id."
    },
    "scoped_tokens": {
      "type": "array",
      "description": "Scoped tokens issued to junior-orchestrators via `ledger scope-token`. Each entry authorises the named scope to complete slices it created.",
      "items": {
        "type": "object",
        "required": ["scope", "token"],
        "properties": {
          "scope": {
            "type": "string",
            "description": "Scope identifier (e.g. junior-orchestrator name or session label)."
          },
          "token": {
            "type": "string",
            "description": "Opaque random token passed as --token to `ledger complete`."
          }
        },
        "additionalProperties": false
      }
    },
    "checkpoint_hold": {
      "type": "string",
      "description": "Top-level hold naming the phase key currently blocking session end. Absent when nothing blocks. Written by the checkpoint CLI command (token-gated). Read by the stop-gate — must be top-level because nested holds are invisible to the stop-gate reader (awaiting_human precedent)."
    }
  },
  "additionalProperties": false,

  "$defs": {
    "advisorGate": {
      "description": "Advisor verdict — either a bare verdict string or a rich object form.",
      "oneOf": [
        {
          "type": "string",
          "enum": ["APPROVE", "CORRECTION", "STOP", "GAPS", "REPLAN"],
          "description": "Bare verdict string (legacy / shorthand form)."
        },
        {
          "type": "object",
          "required": ["verdict"],
          "properties": {
            "verdict": {
              "type": "string",
              "enum": ["APPROVE", "CORRECTION", "STOP", "GAPS", "REPLAN"]
            },
            "citation": {
              "type": "string",
              "description": "Evidence or source the advisor cited."
            },
            "rubric": {
              "type": "string",
              "description": "Rubric text used for the verdict."
            },
            "axes": {
              "type": "object",
              "description": "Scored quality axes (0–3 each).",
              "properties": {
                "correctness":       { "type": "integer", "minimum": 0, "maximum": 3 },
                "completeness":      { "type": "integer", "minimum": 0, "maximum": 3 },
                "over_engineering":  { "type": "integer", "minimum": 0, "maximum": 3 },
                "contract_fitness":  { "type": "integer", "minimum": 0, "maximum": 3 },
                "plan_soundness":    { "type": "integer", "minimum": 0, "maximum": 3 }
              },
              "additionalProperties": false
            }
          },
          "additionalProperties": false
        }
      ]
    },

    "milestoneArtifact": {
      "type": "object",
      "required": ["path", "kind"],
      "description": "A named, hook-validatable evidence artifact declared for milestone verification. A hook can mechanically check: (1) that path/URL is reachable or exists on disk; (2) that captured_build_hash matches the current build hash (stale detection).",
      "properties": {
        "path": {
          "type": "string",
          "description": "Local file path or URL pointing to the artifact (screenshot file, run-output log, live URL)."
        },
        "kind": {
          "type": "string",
          "enum": ["screenshot", "run_output", "live_url", "file"],
          "description": "Evidence category. 'screenshot' — image of running UI; 'run_output' — captured stdout/stderr of a command; 'live_url' — reachable HTTP endpoint; 'file' — any other deliverable file."
        },
        "captured_build_hash": {
          "type": "string",
          "description": "Opaque build/data hash recorded when the artifact was captured. A hook compares this against the current hash to detect staleness — reuses the same freshness mechanism as traceability-classify.mjs (ref.captured_build_hash vs current hash → 'fresh' | 'stale')."
        },
        "label": {
          "type": "string",
          "description": "Human-readable label for the artifact (e.g. 'dashboard screenshot after regeneration'). Optional; aids human review during sign-off."
        }
      },
      "additionalProperties": false
    },

    "milestoneSignoff": {
      "type": "object",
      "required": ["verdict", "verified_by", "verified_at", "artifacts_verified"],
      "description": "Human sign-off record for a milestone. SECURITY: S7 MUST require write_token authority to write this object; recording it without the orchestrator token must be a hard error (exit 1). This prevents a subagent from signing off on its own work.",
      "properties": {
        "verdict": {
          "type": "string",
          "enum": ["APPROVE", "REJECT"],
          "description": "Human decision. APPROVE: pacing gate releases, session may proceed. REJECT: gate holds, remediation required."
        },
        "verified_by": {
          "type": "string",
          "description": "Identity of the human signer — typically a session_id or operator username. Recorded for audit. Must not be a subagent-supplied value when write_token is required."
        },
        "verified_at": {
          "type": "string",
          "format": "date-time",
          "description": "ISO 8601 timestamp of the sign-off, set by the CLI at write time."
        },
        "artifacts_verified": {
          "type": "array",
          "items": { "type": "string" },
          "description": "Paths or URLs of artifacts the human reviewed and confirmed present and correct. Should be a subset of the paths declared in milestone_artifacts."
        },
        "note": {
          "type": "string",
          "description": "Optional human-written note — observations, caveats, or conditions on the APPROVE. Surfaced by the stop-gate when the milestone gate holds."
        }
      },
      "additionalProperties": false
    },

    "slice": {
      "type": "object",
      "required": ["id", "status"],
      "properties": {
        "id": {
          "type": "string",
          "description": "Unique slice identifier within the run (e.g. S1, STD6-A)."
        },
        "status": {
          "type": "string",
          "enum": ["pending", "in_progress", "complete", "skipped"],
          "description": "Current execution state of the slice."
        },
        "wave": {
          "type": ["integer", "null"],
          "description": "Wave number for fan-out ordering. May be absent on legacy slices."
        },
        "kind": {
          "type": "string",
          "enum": ["plan", "diagnose", "design", "impl", "fog"],
          "description": "Work category. Absent slices default to 'impl' at runtime. 'fog' marks an open question with no acceptance criteria required."
        },
        "question": {
          "type": "string",
          "description": "The open question this fog slice is tracking. Only meaningful when kind is 'fog'."
        },
        "desc": {
          "type": "string",
          "description": "Human-readable description of the work."
        },
        "blocked_by": {
          "type": "array",
          "items": { "type": "string" },
          "description": "Ids of slices that must complete before this one starts. Referential integrity is NOT enforced here."
        },
        "acceptance": {
          "type": "array",
          "items": { "type": "string" },
          "description": "Observable acceptance criteria strings. Satisfaction is NOT evaluated by this schema."
        },
        "ticket": {
          "type": "string",
          "pattern": "^[a-zA-Z0-9][a-zA-Z0-9_-]*$",
          "description": "Bare ticket id (e.g. 't1', 'my-ticket') — no path separators, no .md suffix. Path-shaped values like 'tickets/t1.md' are rejected."
        },
        "created_by": {
          "type": "string",
          "description": "Agent or scope identifier that created this slice (S4). Free-form string; distinct from session-scoped claimed_by."
        },
        "covers_ac": {
          "description": "AC coverage: string | string[] — which AC<n> labels this slice covers.",
          "oneOf": [
            { "type": "string" },
            { "type": "array", "items": { "type": "string" } }
          ]
        },
        "decisions": {
          "description": "Decision ids constraining this slice (e.g. \"D-40\"). string | string[] — shape-only, no referential check.",
          "oneOf": [
            { "type": "string" },
            { "type": "array", "items": { "type": "string" } }
          ]
        }
      },
      "additionalProperties": true
    }
  }
}
