{
  "active": true,
  "brief": "",
  "slices": [
    {
      "id": "S0-PROTO",
      "wave": 0,
      "status": "complete",
      "desc": "TBD-1/TBD-2 prototype: rewrite ORCHESTRATION+ENFORCEMENT in both spec shapes, verify Obsidian symlink, end at user decision",
      "blocked_by": [],
      "acceptance": [
        "ORCHESTRATION (4 reqs) and ENFORCEMENT (13 reqs: ENFORCEMENT-R-001, PACING-R-001..011, SEAL-R-001) each rendered in BOTH shapes: requirement-per-file and concept-per-file-with-sections",
        ".groundwork/specs -> ../doc/specs symlink created and Obsidian confirmed to follow it (or fallback relative-link sample produced)",
        "both shapes opened in Obsidian with screenshots of properties pane and backlinks",
        "ENDS with an explicit user decision point recorded as a DECISION event resolving TBD-1 and TBD-2",
        "no production spec files under doc/specs are modified - prototype output lives in a scratch dir"
      ],
      "kind": "design",
      "ticket": "01-choose-spec-shape-prototype",
      "covers_ac": [
        "AC-6"
      ],
      "decisions": [
        "D7",
        "D8"
      ],
      "completed_at": "2026-08-28T16:55:13.047Z",
      "session_id": "a2f49e92-6706-4e3d-91c5-020a94b83f0f"
    },
    {
      "id": "S0-PARITY-CORPUS",
      "wave": 0,
      "status": "complete",
      "desc": "Capture gate/pacing/guard scenario corpus from CURRENT hooks before new implementation lands",
      "blocked_by": [],
      "acceptance": [
        "Corpus of recorded input/verdict pairs captured from the LEGACY hooks at HEAD covering stop-gate, pacing, and the PreToolUse guards",
        "each scenario stores the full hook stdin payload plus the observed exit code and decision output, not a summary",
        "corpus is committed as fixture data so it is replayable after legacy code is deleted",
        "corpus includes at minimum one scenario per PACING-R-001..011 and ENFORCEMENT-R-001 and SEAL-R-001",
        "capture harness invokes hooks by their registered path so the deployed invocation path is exercised"
      ],
      "kind": "design",
      "ticket": "02-research-parity-corpus-capture",
      "covers_ac": [
        "AC-3"
      ],
      "decisions": [
        "D6"
      ],
      "completed_at": "2026-08-28T17:08:26.111Z",
      "session_id": "a2f49e92-6706-4e3d-91c5-020a94b83f0f"
    },
    {
      "id": "S0-INVENTORY",
      "wave": 0,
      "status": "complete",
      "desc": "Enumerate all persisted artefact types with producers/consumers; classify durable vs ephemeral for gw migrate",
      "blocked_by": [],
      "acceptance": [
        "Every persisted artefact type under .groundwork/ and doc/specs/ is listed with its producing module and consuming modules resolved against HEAD",
        "each artefact classified durable (migrates) or ephemeral (not migrated) with the charter D5 rule cited",
        "the 6 modules that reference doc/specs/_generated are enumerated",
        "output identifies which fields have no destination in the Markdown+frontmatter model - the lossy set - before migration is written"
      ],
      "kind": "plan",
      "ticket": "03-research-artefact-inventory",
      "covers_ac": [
        "AC-4"
      ],
      "decisions": [
        "D1",
        "D5"
      ],
      "completed_at": "2026-08-28T16:53:57.630Z",
      "session_id": "a2f49e92-6706-4e3d-91c5-020a94b83f0f"
    },
    {
      "id": "S1-SCHEMA",
      "wave": 1,
      "status": "complete",
      "desc": "TRACER BULLET: shared Zod frontmatter schemas + file-layout contract + gray-matter/wikilink primitives that all later slices import",
      "blocked_by": [
        "S0-INVENTORY"
      ],
      "acceptance": [
        "One shared Zod schema module defines frontmatter for every note kind \u2014 motive, slice, gate, decision (MADR), ticket, requirement (D-13 hybrid: ears_pattern, verification_method), concept index, and the D-15 design note kinds (MOC, concept, flow, component, recipe, reference, glossary) \u2014 and is the single import point for CLI and hooks",
        "file-layout contract documents the exact on-disk path for every note kind incl. the design/ folder IA, assets/ adjacency, and the tracker_path config indirection",
        "decision-id normalization: schema accepts legacy D1..D8 and canonical D-n, emits canonical D-n",
        "gray-matter round-trip proven by a test that parses and re-serializes a note with unusual YAML and byte-compares the result",
        "surgical single-key frontmatter write patches only the target line range \u2014 test asserts untouched lines are byte-identical including comments and key order",
        "wikilink formatter escapes # | ^ [ ] and strips .md \u2014 test covers each escape character",
        "zod and gray-matter added as direct dependencies in package.json",
        "NO other slice may define a frontmatter type \u2014 this slice owns src/gw/schema and src/gw/fm exclusively"
      ],
      "kind": "impl",
      "ticket": "04-model-frontmatter-schema-contract",
      "decisions": [
        "D1",
        "D3",
        "D4"
      ],
      "covers_ac": [
        "AC-2"
      ],
      "completed_at": "2026-08-29T10:00:31.674Z",
      "session_id": "a2f49e92-6706-4e3d-91c5-020a94b83f0f"
    },
    {
      "id": "S2-CLI",
      "wave": 2,
      "status": "complete",
      "desc": "gw binary skeleton: Bun single-binary build, command router, --json envelope on every command",
      "blocked_by": [
        "S1-SCHEMA"
      ],
      "acceptance": [
        "bun build produces a single self-contained gw binary and gw --help lists every command",
        "every command accepts --json and emits a machine-parseable envelope on both success and failure",
        "exit codes preserve the existing contract 0 success 1 operational failure 2 usage error",
        "owns src/gw/cli and the build config only - does not touch store or hook modules"
      ],
      "kind": "impl",
      "ticket": "05-build-gw-cli-skeleton",
      "covers_ac": [
        "AC-1"
      ],
      "decisions": [
        "D4"
      ],
      "completed_at": "2026-08-29T10:18:02.292Z",
      "session_id": "a2f49e92-6706-4e3d-91c5-020a94b83f0f"
    },
    {
      "id": "S2-MOTIVE",
      "wave": 2,
      "status": "in_progress",
      "desc": "Motive charter, ticket, and decision notes as Markdown+frontmatter on the new parallel layout",
      "blocked_by": [
        "S1-SCHEMA"
      ],
      "acceptance": [
        "Charter, ticket, and decision notes read and write through the S1 schema with no local type definitions",
        "decisions carry status and rationale as frontmatter properties and relations as wikilinks",
        "TBD/TBR open items are represented as notes - note that TBD is NOT a journal event type today so the source is charter prose",
        "writes land in the parallel directory per D5 so existing hooks keep working",
        "owns src/gw/store/motive only"
      ],
      "kind": "impl",
      "ticket": "06-build-motive-note-store",
      "covers_ac": [
        "AC-2"
      ],
      "decisions": [
        "D1",
        "D2"
      ],
      "claimed_by": "a2f49e92-6706-4e3d-91c5-020a94b83f0f",
      "claimed_at": "2026-08-29T10:08:01.068Z"
    },
    {
      "id": "S2-SLICE",
      "wave": 2,
      "status": "in_progress",
      "desc": "Slice-as-note, per-session gate note, and seal sidecar replacing the run ledger JSON",
      "blocked_by": [
        "S1-SCHEMA"
      ],
      "acceptance": [
        "Each slice is a note under its motive with session and wave frontmatter properties per D2",
        "blocked_by and covers_ac are wikilink relations resolvable as Obsidian backlinks",
        "the write-seal is a sidecar hash file NOT a frontmatter key so a human edit in Obsidian does not invalidate machine trust - test edits a note by hand and asserts the seal detects it",
        "querying slices by session property reproduces what the ledger session_id field returns today",
        "owns src/gw/store/slice, gate, seal only"
      ],
      "kind": "impl",
      "ticket": "07-build-slice-gate-seal-store",
      "covers_ac": [
        "AC-2"
      ],
      "decisions": [
        "D1",
        "D2"
      ],
      "claimed_by": "a2f49e92-6706-4e3d-91c5-020a94b83f0f",
      "claimed_at": "2026-08-29T10:08:01.068Z"
    },
    {
      "id": "S2-MIGRATE",
      "wave": 3,
      "status": "pending",
      "desc": "gw migrate: lossless conversion of durable artefacts over the real corpus; ephemeral state untouched",
      "blocked_by": [
        "S1-SCHEMA",
        "S0-INVENTORY",
        "S2-MOTIVE"
      ],
      "acceptance": [
        "gw migrate --dry-run reports zero lossy conversions over the real motive corpus - note HEAD has 15 motive dirs not the 14 the charter states",
        "round-trip test converts and converts back and byte-compares the semantic content for every motive",
        "ephemeral state (per-session ledgers, seals, struggle tallies, open-items) is provably untouched - test asserts mtimes unchanged",
        "lossy set identified in S0-INVENTORY is either handled or explicitly reported, never silently dropped",
        "owns src/gw/migrate only"
      ],
      "kind": "impl",
      "ticket": "08-build-gw-migrate",
      "covers_ac": [
        "AC-4"
      ],
      "decisions": [
        "D5"
      ]
    },
    {
      "id": "S3-HOOKS",
      "wave": 3,
      "status": "pending",
      "desc": "Port stop-gate/pacing/guard logic into gw; hooks become one-line shims invoking gw hook <name>",
      "blocked_by": [
        "S2-CLI",
        "S2-SLICE"
      ],
      "acceptance": [
        "Every hook registered in hooks/hooks.json is a one-line shim invoking gw hook <name>",
        "shims are invoked by their registered bare path and are executable - assert the exec bit, do not test via node <path>",
        "stop-gate reads slices by session property and the session gate note verdict per D2 rather than a ledger JSON file",